{
  "schema_version": "0.1.0",
  "session_id": "pool-extended-session",
  "synthetic": true,
  "product": {
    "name": "memveil",
    "version": "0.1.0",
    "build": null
  },
  "environment": {
    "mode": "unknown",
    "detection": "unverified",
    "asserted_mode": null,
    "attestation": "not_performed",
    "evidence": []
  },
  "capture": {
    "mode": "synthetic",
    "window": {
      "start_ns": "1000000000",
      "end_ns": "4000000000"
    },
    "filters": {
      "device": null
    },
    "finalized": true,
    "end_reason": "duration"
  },
  "device_catalog": {
    "devices": [
      {
        "device_id": "dev-1",
        "name": "testdev0",
        "driver": "synthetic-test",
        "identity_status": "resolved"
      }
    ]
  },
  "baseline": {
    "complete": false,
    "region_observations": []
  },
  "capabilities": {
    "bounce_attempts": {
      "status": "unavailable",
      "reason": "No attempt source in this fixture.",
      "hooks": [],
      "profile_id": null
    },
    "mapping_lifecycle": {
      "status": "unavailable",
      "reason": "No lifecycle source in this fixture.",
      "hooks": [],
      "profile_id": null
    },
    "copy_bytes": {
      "status": "unavailable",
      "reason": "No copy source in this fixture.",
      "hooks": [],
      "profile_id": null
    },
    "sync_requests": {
      "status": "unavailable",
      "reason": "No sync source in this fixture.",
      "hooks": [],
      "profile_id": null
    },
    "conversion_results": {
      "status": "unavailable",
      "reason": "No conversion source in this fixture.",
      "hooks": [],
      "profile_id": null
    },
    "region_state": {
      "status": "unavailable",
      "reason": "No region source in this fixture.",
      "hooks": [],
      "profile_id": null
    },
    "pool_stats": {
      "status": "partial",
      "reason": "Authored pool samples.",
      "hooks": [
        "swiotlb:debugfs"
      ],
      "profile_id": "synthetic-pool-1"
    },
    "task_context": {
      "status": "unavailable",
      "reason": "No observer context in this fixture.",
      "hooks": [],
      "profile_id": null
    }
  },
  "quality": {
    "detail": {
      "status": "complete_for_scope",
      "loss_count": "0",
      "scope": "2 pool events",
      "reason": "Authored fixture: no loss."
    },
    "aggregate": {
      "status": "unavailable",
      "loss_count": null,
      "scope": "counter snapshots",
      "reason": "No counter snapshots in this fixture."
    },
    "correlation": {
      "status": "not_applicable",
      "loss_count": null,
      "scope": "pool validation",
      "reason": "Pool samples need no correlation."
    },
    "baseline": {
      "status": "not_applicable",
      "loss_count": null,
      "scope": "pool validation",
      "reason": "Pool samples need no baseline."
    },
    "terminal": {
      "status": "complete_for_scope",
      "loss_count": "0",
      "scope": "authored fixture finalization",
      "reason": "Authored fixture: finalized."
    }
  }
}
