{"schema_version":"0.1.0","session_id":"cap-99328216370946-3387001","boot_id":"00000000-0000-0000-0000-000000000000","synthetic":false,"product":{"name":"memveil","version":"memveil-0.1.0"},"environment":{"mode":"none","detection":"kernel_reported","attestation":"not_performed","evidence":[{"type":"provenance","source":"profile.decision","interpretation":"validated linux-x86_64-7.0.0-34-generic: bindings hold"},{"type":"provenance","source":"object.sha256","interpretation":"47be66788e267aa0ea4bb0e80a6a89fcb45882d6dbaac40b64d46b4f39d88972"},{"type":"provenance","source":"ring.bytes","interpretation":"8388608"},{"type":"provenance","source":"kernel.release","interpretation":"7.0.0-34-generic"},{"type":"provenance","source":"kernel.build_id","interpretation":"165b9a4f9609ede635b85d0d1241ee95208e4548"},{"type":"provenance","source":"config.sha256","interpretation":"e75c0adab6020e72844d7431cf801a02b94ed32efc251c3b0fb80c021d065180"},{"type":"provenance","source":"config.src","interpretation":"file"},{"type":"provenance","source":"btf.sha256","interpretation":"16205476ae9b6d621e056249052a5789d7f22c6a8c27bf291eb787f3bda5090e"},{"type":"provenance","source":"format.sha256","interpretation":"7e95fff18d1bd16c18342d821e78680a0126ff84054936fbc641e181810f0b62"},{"type":"provenance","source":"image.sha256","interpretation":"7efd88a7facf80874d781ccb2c2421f0aaaa575e3b94760430619e826f490117"},{"type":"provenance","source":"bridge.sha256","interpretation":"bf1f5d17a41eae92353530998e22a6a9d736f1e7ec0d09be6b4ae54ebcd4ac9c"},{"type":"provenance","source":"bridge.abi","interpretation":"abi-v1 (required)"},{"type":"provenance","source":"attach_ns","interpretation":"99328223471010"},{"type":"provenance","source":"detach_ns","interpretation":"99338287082218"},{"type":"provenance","source":"drain_closure","interpretation":"proven"},{"type":"provenance","source":"measurement_scope","interpretation":"ordinals below observed at the end cut"},{"type":"provenance","source":"output.fs","interpretation":"btrfs"}]},"capture":{"mode":"live","window":{"start_ns":"99328216370946","end_ns":"99338387247688"},"filters":{},"finalized":true,"end_reason":"duration"},"device_catalog":{"devices":[]},"baseline":{"complete":false,"region_observations":[]},"capabilities":{"bounce_attempts":{"status":"partial","reason":"capture ok, 0 attempts persisted; admitted under linux-x86_64-7.0.0-34-generic; device detail grouped by observed name scope","hooks":["swiotlb:swiotlb_bounced"],"profile_id":"linux-x86_64-7.0.0-34-generic"},"mapping_lifecycle":{"status":"unavailable","reason":"No map_result source in this capture.","hooks":[]},"copy_bytes":{"status":"unavailable","reason":"No copy source in this capture.","hooks":[]},"sync_requests":{"status":"unavailable","reason":"No sync source in this capture.","hooks":[]},"conversion_results":{"status":"unavailable","reason":"No conversion source in this capture.","hooks":[]},"region_state":{"status":"unavailable","reason":"No region source in this capture.","hooks":[]},"pool_stats":{"status":"unavailable","reason":"No pool source in this capture.","hooks":[]},"task_context":{"status":"unavailable","reason":"No observer context in this capture.","hooks":[]}},"quality":{"detail":{"status":"complete_for_scope","loss_count":"0","scope":"0 bounce_attempt events","reason":"detail loss 0 (submit_fail=(0) malformed=(0) dropped=(0) size_omitted=(0) duration_omitted=(0) signal_omitted=(0) rejected=(0) write_failed=(0))","evidence_refs":[]},"aggregate":{"status":"complete_for_scope","loss_count":"0","scope":"counter snapshots","reason":"counter snapshots present (valid cut, identity holds, coverage valid)","evidence_refs":[]},"correlation":{"status":"not_applicable","loss_count":null,"scope":"attempt counting","reason":"Attempt counting needs no cross-event correlation.","evidence_refs":[]},"baseline":{"status":"not_applicable","loss_count":null,"scope":"attempt metrics","reason":"Attempt metrics need no baseline.","evidence_refs":[]},"terminal":{"status":"partial","loss_count":null,"scope":"capture finalization","reason":"terminal settlement unproven; stop protocol not yet proven","evidence_refs":[]}}}